{
  "mandate_id": "LIVE-GAP-MISS-CAP-001",
  "version": "1.0",
  "generated": "2026-04-08T11:55:10.647Z",
  "anchor": {
    "mission_intent": "Conduct penetration test of web application including exploitation of discovered vulnerabilities",
    "minimum": {
      "description": "Identify all web application vulnerabilities with CVSS scores"
    },
    "constraints": [
      "scope.target IN ['webapp.corp.local', 'api.corp.local']",
      "FORBIDS data_exfiltration",
      "FORBIDS denial_of_service"
    ],
    "anchor_hash": "1dff20b7123efb32ae3493274a25e9dbf5a903640f30e8ee5d28e8c6439435db",
    "target": {
      "description": "Demonstrate exploitability of critical findings with proof-of-concept"
    },
    "risk_tolerance": {
      "max_autonomous_score": "MEDIUM",
      "escalate_above": "HIGH"
    }
  },
  "courses_of_action": [
    {
      "coa_id": "COA-1",
      "approach": "Minimal manual assessment approach",
      "task_dag": {
        "nodes": [
          {
            "id": "1",
            "name": "Manual Assessment",
            "description": "Manual assessment of webapp.corp.local, api.corp.local"
          },
          {
            "id": "2",
            "name": "Results Documentation",
            "description": "Document assessment findings"
          }
        ],
        "edges": [
          {
            "from": "1",
            "to": "2"
          }
        ]
      },
      "risk_assessment": {
        "score": "LOW",
        "confidence_min": "LOW",
        "confidence_target": "MEDIUM",
        "primary_factor": "execution_uncertainty"
      },
      "off_nominal_triggers": [
        "target.scope_violations > 0",
        "execution.rate > 100"
      ],
      "procedures": [
        "Step 1: Manual Assessment",
        "Step 2: Results Documentation"
      ]
    }
  ],
  "recommendation": {
    "primary_coa": "COA-1",
    "fallback_sequence": [],
    "rationale": "Single COA COA-1: Minimal manual assessment approach"
  },
  "trace": {
    "chain_hash": "0f8a2753bcce145a55f0cf7ddc493ed1a37dd4e1e66f5142f804b823a6199120",
    "entry_count": 6,
    "entries": [
      {
        "role": "Intake",
        "decision_type": "intake_phase",
        "timestamp": "2026-04-08T11:55:10.647Z",
        "parent_hashes": [],
        "search": {
          "query": "Intake phase execution for mission LIVE-GAP-MISS-CAP-001",
          "source": "pipeline_state",
          "k": 5,
          "total_results": 5
        },
        "results": [
          {
            "id": "mission_id",
            "score": 1.0,
            "summary": "mission_id=LIVE-GAP-MISS-CAP-001"
          },
          {
            "id": "constraint_count",
            "score": 1.0,
            "summary": "constraint_count=3"
          },
          {
            "id": "scope_count",
            "score": 1.0,
            "summary": "scope_count=2"
          },
          {
            "id": "llm_used",
            "score": 1.0,
            "summary": "llm_used=False"
          },
          {
            "id": "llm_fallback",
            "score": 1.0,
            "summary": "llm_fallback=False"
          }
        ],
        "selected": "Intake",
        "selection_criteria": "role completed without errors",
        "confidence": "HIGH",
        "selection": {
          "selected": "Intake",
          "criteria": "role completed without errors",
          "confidence": "HIGH",
          "rationale": "Intake complete: mission_id=LIVE-GAP-MISS-CAP-001"
        },
        "rationale": "Intake complete: mission_id=LIVE-GAP-MISS-CAP-001",
        "mission_id": "LIVE-GAP-MISS-CAP-001",
        "risk": {},
        "search_trace_version": "1.0",
        "metadata": {
          "role_status": "success"
        },
        "hash": "7f3b309d904a740b3635dbe5c4bb70bf39b7efd96ce172f47f555210667a97eb"
      },
      {
        "role": "Interpreter",
        "decision_type": "interpreter_phase",
        "timestamp": "2026-04-08T11:55:10.647Z",
        "parent_hashes": [
          "7f3b309d904a740b3635dbe5c4bb70bf39b7efd96ce172f47f555210667a97eb"
        ],
        "search": {
          "query": "Interpreter phase execution for mission LIVE-GAP-MISS-CAP-001",
          "source": "pipeline_state",
          "k": 5,
          "total_results": 5
        },
        "results": [
          {
            "id": "anchor_hash",
            "score": 1.0,
            "summary": "anchor_hash=1dff20b7123efb32ae3493274a25e9dbf5a903640f30e8ee5d28e8c6439435db"
          },
          {
            "id": "constraint_count",
            "score": 1.0,
            "summary": "constraint_count=3"
          },
          {
            "id": "gaps_detected",
            "score": 1.0,
            "summary": "gaps_detected=0"
          },
          {
            "id": "llm_used",
            "score": 1.0,
            "summary": "llm_used=False"
          },
          {
            "id": "llm_fallback",
            "score": 1.0,
            "summary": "llm_fallback=False"
          }
        ],
        "selected": "Interpreter",
        "selection_criteria": "role completed without errors",
        "confidence": "HIGH",
        "selection": {
          "selected": "Interpreter",
          "criteria": "role completed without errors",
          "confidence": "HIGH",
          "rationale": "Anchor extracted: hash=1dff20b7123efb32..."
        },
        "rationale": "Anchor extracted: hash=1dff20b7123efb32...",
        "mission_id": "LIVE-GAP-MISS-CAP-001",
        "risk": {},
        "search_trace_version": "1.0",
        "metadata": {
          "role_status": "success"
        },
        "hash": "9be71070851a7bbd6ded5821102d8fe59e80f5ef8ad46f5321e5e5600b85cfc3"
      },
      {
        "role": "Decomposition",
        "decision_type": "decomposition_phase",
        "timestamp": "2026-04-08T11:55:10.647Z",
        "parent_hashes": [
          "9be71070851a7bbd6ded5821102d8fe59e80f5ef8ad46f5321e5e5600b85cfc3"
        ],
        "search": {
          "query": "Decomposition phase execution for mission LIVE-GAP-MISS-CAP-001",
          "source": "pipeline_state",
          "k": 6,
          "total_results": 6
        },
        "results": [
          {
            "id": "coa_count",
            "score": 1.0,
            "summary": "coa_count=1"
          },
          {
            "id": "coa_ids",
            "score": 1.0,
            "summary": "coa_ids: 1 item(s)"
          },
          {
            "id": "gaps_detected",
            "score": 1.0,
            "summary": "gaps_detected=1"
          },
          {
            "id": "nist_map",
            "score": 1.0,
            "summary": "nist_map: 7 key(s)"
          },
          {
            "id": "llm_used",
            "score": 1.0,
            "summary": "llm_used=False"
          }
        ],
        "selected": "Decomposition",
        "selection_criteria": "role completed without errors",
        "confidence": "HIGH",
        "selection": {
          "selected": "Decomposition",
          "criteria": "role completed without errors",
          "confidence": "HIGH",
          "rationale": "Generated 1 COA(s) (1 gap(s) detected)"
        },
        "rationale": "Generated 1 COA(s) (1 gap(s) detected)",
        "mission_id": "LIVE-GAP-MISS-CAP-001",
        "risk": {},
        "search_trace_version": "1.0",
        "metadata": {
          "role_status": "success"
        },
        "hash": "c3c6bc25d72be1ba84b9a429007c541b065363cc3c22d52a527cc5bdf5a92493"
      },
      {
        "role": "Procedure",
        "decision_type": "procedure_phase",
        "timestamp": "2026-04-08T11:55:10.647Z",
        "parent_hashes": [
          "c3c6bc25d72be1ba84b9a429007c541b065363cc3c22d52a527cc5bdf5a92493"
        ],
        "search": {
          "query": "Procedure phase execution for mission LIVE-GAP-MISS-CAP-001",
          "source": "pipeline_state",
          "k": 7,
          "total_results": 7
        },
        "results": [
          {
            "id": "procedure_count",
            "score": 1.0,
            "summary": "procedure_count=2"
          },
          {
            "id": "trigger_count",
            "score": 1.0,
            "summary": "trigger_count=2"
          },
          {
            "id": "missing_ttp_gaps",
            "score": 1.0,
            "summary": "missing_ttp_gaps=0"
          },
          {
            "id": "missing_procedure_gaps",
            "score": 1.0,
            "summary": "missing_procedure_gaps=0"
          },
          {
            "id": "gaps_detected",
            "score": 1.0,
            "summary": "gaps_detected=0"
          }
        ],
        "selected": "Procedure",
        "selection_criteria": "role completed without errors",
        "confidence": "HIGH",
        "selection": {
          "selected": "Procedure",
          "criteria": "role completed without errors",
          "confidence": "HIGH",
          "rationale": "Generated 2 procedures, 2 triggers across 1 COA(s)"
        },
        "rationale": "Generated 2 procedures, 2 triggers across 1 COA(s)",
        "mission_id": "LIVE-GAP-MISS-CAP-001",
        "risk": {},
        "search_trace_version": "1.0",
        "metadata": {
          "role_status": "success"
        },
        "hash": "fe976b755e93d0ff9c8ccd47d7b449dea1cd05d27d0e3ef31c421e243b52c8d4"
      },
      {
        "role": "Binding",
        "decision_type": "binding_phase",
        "timestamp": "2026-04-08T11:55:10.647Z",
        "parent_hashes": [
          "fe976b755e93d0ff9c8ccd47d7b449dea1cd05d27d0e3ef31c421e243b52c8d4"
        ],
        "search": {
          "query": "Binding phase execution for mission LIVE-GAP-MISS-CAP-001",
          "source": "pipeline_state",
          "k": 4,
          "total_results": 4
        },
        "results": [
          {
            "id": "primary_coa",
            "score": 1.0,
            "summary": "primary_coa=COA-1"
          },
          {
            "id": "risk_scores",
            "score": 1.0,